Symbol,Name,Last Sale,Net Change,% Change,Market Cap,Country,IPO Year,Volume,Sector,Industry
PSN,Parsons Corporation Common Stock,$35.70,-0.06,-0.168%,3595958148.00,,2019,144455,Technology,EDP Services
PSNL,Personalis Inc. Common Stock,$38.29,-3.13,-7.557%,1490737103.00,United States,2019,1309267,Health Care,Medical Specialities
PSO,Pearson Plc Common Stock,$9.38,0.06,0.644%,7064078919.00,United Kingdom,,144550,Consumer Services,Books
PSTG,Pure Storage Inc. Class A Common Stock,$22.795,-1.125,-4.703%,6218726494.00,,2015,3118527,Technology,Electronic Components
PSTH,Pershing Square Tontine Holdings Ltd. Class A Common Stock,$25.99,0.00,0.00%,5198002599.00,,2020,2983664,Finance,Business Services
PSTH.WS,Pershing Square Tontine Holdings Ltd. Warrants exercisable for one share of Class A Common Stock for $23.00 per share,NA,,,,,,0,,
PSTI,Pluristem Therapeutics Inc. Common Stock,$7.1101,-0.0199,-0.279%,182255916.00,Israel,,724054,Health Care,Biotechnology: Biological Products (No Diagnostic Substances)
PSTL,Postal Realty Trust Inc. Class A Common Stock,$16.425,0.145,0.891%,155652465.00,,2019,16348,Consumer Services,Real Estate Investment Trusts
PSTV,PLUS THERAPEUTICS Inc. Common Stock ,$2.145,-0.195,-8.333%,10252208.00,United States,,201638,Health Care,Medical/Dental Instruments
PSTX,Poseida Therapeutics Inc. Common Stock,$11.29,0.25,2.264%,697947913.00,United States,2020,392321,Health Care,Biotechnology: Biological Products (No Diagnostic Substances)
PSX,Phillips 66 Common Stock,$68.475,-0.855,-1.233%,29909892668.00,United States,,1866254,Energy,Integrated oil Companies
PSXP,Phillips 66 Partners LP Common Units representing limited partner interest in the Partnership,$26.31,-0.13,-0.492%,6007629241.00,United States,2013,608617,Energy,Natural Gas Distribution
PT,Pintec Technology Holdings Limited American Depositary Shares,$0.94,-0.066,-6.561%,40549961.00,China,2018,141472,Technology,Computer Software: Programming Data Processing
PTA,Cohen & Steers Tax-Advantaged Preferred Securities and Income Fund Common Shares of Beneficial Interest,$26.0999,0.0199,0.076%,0.00,,2020,80539,,
PTC,PTC Inc. Common Stock,$117.725,-1.085,-0.913%,13734124363.00,United States,,170555,Technology,Computer Software: Prepackaged Software
PTCT,PTC Therapeutics Inc. Common Stock,$63.49,-0.64,-0.998%,4332287069.00,United States,2013,88289,Health Care,Major Pharmaceuticals
PTE,PolarityTE Inc. Common Stock,$0.6904,0.0304,4.606%,30854889.00,United States,,1952308,Health Care,Biotechnology: Biological Products (No Diagnostic Substances)
PTEN,Patterson-UTI Energy Inc. Common Stock,$5.21,-0.04,-0.762%,976842568.00,United States,1993,679426,Energy,Oil & Gas Production
PTGX,Protagonist Therapeutics Inc. Common Stock,$21.52,-1.53,-6.638%,925762338.00,United States,2016,477595,Health Care,Major Pharmaceuticals
PTICU,PropTech Investment Corporation II Unit,$10.34,-0.12,-1.147%,0.00,United States,2020,145879,Finance,Business Services
PTK,PTK Acquisition Corp. Common Stock,$10.19,-0.01,-0.098%,146481250.00,United States,2020,13179,Finance,Business Services
PTK.U,PTK Acquisition Corp. Units,NA,,,,United States,2020,0,,
PTK.WS,PTK Acquisition Corp. Warrants each whole warrant exercisable for one half (1/2) of a share of Common Stock at an exercise price of $11.50,NA,,,,United States,,0,,
PTMN,Portman Ridge Finance Corporation Common Stock,$1.71,0.01,0.588%,75529093.00,United States,,315523,,
PTN,Palatin Technologies Inc. Common Stock,$0.7913,0.0222,2.886%,181920904.00,United States,,8301295,Health Care,Major Pharmaceuticals
PTNR,Partner Communications Company Ltd. American Depositary Shares,$5.31,-0.0673,-1.252%,975542081.00,Israel,,3270,Public Utilities,Telecommunications Equipment
PTON,Peloton Interactive Inc. Class A Common Stock,$148.51,-3.67,-2.412%,43443990437.00,United States,2019,8204744,Energy,Consumer Electronics/Appliances
PTPI,Petros Pharmaceuticals Inc. Common Stock,$4.43,-0.25,-5.342%,43005301.00,United States,,134166,Health Care,Major Pharmaceuticals
PTR,PetroChina Company Limited Common Stock,$31.11,0.03,0.097%,56937826194.00,China,,65416,Energy,Oil & Gas Production
PTRS,Partners Bancorp Common Stock,$6.42,-0.08,-1.231%,114341567.00,United States,,17346,Finance,Major Banks
PTSI,P.A.M. Transportation Services Inc. Common Stock,$45.09,-0.44,-0.966%,258569146.00,United States,1986,2276,Transportation,Trucking Freight/Courier Services
PTVCA,Protective Insurance Corporation Class A Common Stock,$14.5714,-0.4286,-2.857%,207873654.00,United States,,1959,Finance,Property-Casualty Insurers
PTVCB,Protective Insurance Corporation Class B Common Stock,$13.60,-0.04,-0.293%,194015791.00,United States,,41541,Finance,Property-Casualty Insurers
PTVE,Pactiv Evergreen Inc. Common stock,$17.69,-0.64,-3.492%,3133919890.00,United States,2020,159420,Consumer Durables,Containers/Packaging
PTY,Pimco Corporate & Income Opportunity Fund,$17.7935,0.0635,0.358%,1889691319.00,United States,2002,206514,,
PUBM,PubMatic Inc. Class A Common Stock,$26.39,-1.82,-6.452%,1262141441.00,United States,2020,288982,Technology,Computer Software: Programming Data Processing
PUK,Prudential Public Limited Company Common Stock,$37.17,0.44,1.198%,48497356968.00,United Kingdom,,124616,Finance,Life Insurance
PUK.PR,Prudential Public Limited Company,NA,,,,,,0,,
PUK.PRA,Prudential Public Limited Company,NA,,,,,,0,,
PULM,Pulmatrix Inc. Common Stock,$1.18,-0.01,-0.84%,40600830.00,United States,2014,665032,Health Care,Major Pharmaceuticals
PUMP,ProPetro Holding Corp. Common Stock,$7.415,-0.015,-0.202%,748268241.00,United States,2017,479417,Energy,Oilfield Services/Equipment
PUYI,Puyi Inc. American Depository Shares,$6.18,0.00,0.00%,372744698.00,China,2019,122,Finance,Investment Managers
PVAC,Penn Virginia Corporation Common Stock,$10.265,-0.165,-1.582%,156032465.00,United States,,241123,Energy,Oil & Gas Production
PVBC,Provident Bancorp Inc. (MD) Common Stock,$12.27,0.05,0.409%,238346480.00,United States,2015,11611,Finance,Savings Institutions
PVG,Pretium Resources Inc. Ordinary Shares (Canada),$11.245,-0.085,-0.75%,2105668340.00,Canada,,637572,Basic Industries,Precious Metals
PVH,PVH Corp. Common Stock,$93.295,-1.615,-1.702%,6633297824.00,United States,,300733,Consumer Non-Durables,Apparel
PVL,Permianville Royalty Trust Trust Units ,$0.73,-0.04,-5.195%,24090000.00,United States,2011,207072,Energy,Oil & Gas Production
PW,Power REIT (MD) Common Stock,$26.1965,-0.5735,-2.142%,50196135.00,United States,,18941,Consumer Services,Real Estate Investment Trusts
PW.PRA,Power REIT,NA,,,,,,0,,
PWFL,PowerFleet Inc. Common Stock,$7.24,-0.28,-3.723%,225170835.00,United States,,76905,Capital Goods,Telecommunications Equipment
PWOD,Penns Woods Bancorp Inc. Common Stock,$26.30,-0.17,-0.642%,185461893.00,United States,,6291,Finance,Major Banks
PWR,Quanta Services Inc. Common Stock,$70.07,-0.64,-0.905%,9729983263.00,United States,,367168,Capital Goods,Engineering & Construction
PXD,Pioneer Natural Resources Company Common Stock,$111.05,0.40,0.362%,18258673648.00,United States,,853846,Energy,Oil & Gas Production
PXLW,Pixelworks Inc.  Common Stock,$2.76,-0.03,-1.075%,140404520.00,United States,2000,373076,Technology,Semiconductors
PXMD,PaxMedica Inc.,NA,,,,,,0,,
PXS,Pyxis Tankers Inc. Common Stock,$0.9048,0.0948,11.704%,19507384.00,Greece,,1368885,Transportation,Marine Transportation
PXSAP,Pyxis Tankers Inc. 7.75% Series A Cumulative Convertible Preferred Shares,$14.1999,0.0199,0.14%,0.00,Greece,,1200,Transportation,Marine Transportation
PXSAW,Pyxis Tankers Inc. Warrant,$0.2384,0.0017,0.718%,0.00,Greece,,6294,Transportation,Marine Transportation
PYN,PIMCO New York Municipal Income Fund III Common Shares of Beneficial Interest,$8.77,-0.04,-0.454%,50235358.00,United States,2002,7176,,
PYPD,PolyPid Ltd. Ordinary Shares,$9.50,-0.05,-0.524%,175696268.00,Israel,2020,132108,Health Care,Medical/Dental Instruments
PYPL,PayPal Holdings Inc. Common Stock,$230.52,-5.21,-2.21%,270098395811.00,United States,,6618231,Miscellaneous,Business Services
PYS,Merrill Lynch Depositor Inc PPlus Tr Ser RRD-1 Tr Ctf Cl A,$20.86,1.6631,8.663%,0.00,United States,,362,Finance,Finance: Consumer Services
PYT,PPlus Tr GSC-2 Tr Ctf Fltg Rate,$23.55,0.05,0.213%,0.00,United States,,536,Finance,Finance: Consumer Services
PZC,PIMCO California Municipal Income Fund III Common Shares of Beneficial Interest,$10.255,0.035,0.342%,229442663.00,United States,2002,43122,,
PZG,Paramount Gold Nevada Corp. Common Stock,$1.19,0.10,9.174%,40802350.00,United States,2015,506078,Basic Industries,Precious Metals
PZN,Pzena Investment Management Inc Class A Common Stock,$7.1741,-0.1659,-2.26%,510580460.00,United States,2007,48462,Finance,Investment Managers
PZZA,Papa John's International Inc. Common Stock,$85.63,-3.57,-4.002%,2821695516.00,United States,1993,232032,Consumer Services,Restaurants
QADA,QAD Inc. Class A Common Stock,$62.17,0.17,0.274%,1286861617.00,United States,,24567,Technology,Computer Software: Prepackaged Software
QADB,QAD Inc. Class B Common Stock,$47.2341,0.00,0.00%,977702273.00,United States,,199,Technology,Computer Software: Prepackaged Software
QCOM,QUALCOMM Incorporated Common Stock,$148.465,0.725,0.491%,167913915000.00,United States,1991,2597187,Technology,Radio And Television Broadcasting And Communications Equipment
QCRH,QCR Holdings Inc. Common Stock,$38.77,-1.16,-2.905%,612308451.00,United States,,12226,Finance,Major Banks
QD,Qudian Inc. American Depositary Shares each representing one Class A Ordinary Share,$1.215,0.025,2.101%,308281159.00,China,2017,2091405,Finance,Finance: Consumer Services
QDEC,FT Cboe Vest Growth-100 Buffer ETF - December,$20.03,0.0031,0.015%,,United States,2020,95169,,
QDEL,Quidel Corporation Common Stock,$180.215,-3.025,-1.651%,7581220824.00,United States,,550129,Health Care,Biotechnology: In Vitro & In Vivo Diagnostic Substances
QELL,Qell Acquisition Corp. Class A Ordinary Shares,$12.425,-0.625,-4.789%,589410938.00,United States,2020,1176248,Finance,Business Services
QELLU,Qell Acquisition Corp. Unit,$13.30,-0.50,-3.623%,0.00,United States,2020,109036,Finance,Business Services
QELLW,Qell Acquisition Corp. Warrant,$3.4999,-0.2001,-5.408%,0.00,United States,2020,300575,Finance,Business Services
QEP,QEP Resources Inc. Common Stock,$2.345,-0.025,-1.055%,569684076.00,United States,,4922070,Energy,Oil & Gas Production
QFIN,360 DigiTech Inc. American Depositary Shares,$10.62,0.23,2.214%,1615424640.00,China,2018,753111,Finance,Finance: Consumer Services
QGEN,Qiagen N.V. Common Shares ,$52.64,0.15,0.286%,12041347360.00,Netherlands,,709393,Health Care,Biotechnology: Biological Products (No Diagnostic Substances)
QH,Quhuo Limited American Depository Shares,$7.08,0.02,0.283%,367497383.00,China,2020,139805,Miscellaneous,Business Services
QIWI,QIWI plc American Depositary Shares,$10.2304,0.0304,0.298%,641578819.00,Cyprus,2013,340515,Miscellaneous,Business Services
QK,Q&K International Group Limited American Depositary Shares,$2.7742,-0.0458,-1.624%,132792709.00,China,2019,83223,Finance,Real Estate
QLGN,Qualigen Therapeutics Inc. Common Stock,$3.02,-0.11,-3.514%,76803710.00,United States,2015,1558155,Health Care,Major Pharmaceuticals
QLYS,Qualys Inc. Common Stock,$118.55,-5.08,-4.109%,4625416863.00,United States,2012,275536,Technology,Computer Software: Prepackaged Software
QMCO,Quantum Corporation Common Stock,$5.67,0.01,0.177%,230997002.00,United States,,146020,Technology,Electronic Components
QNST,QuinStreet Inc. Common Stock,$21.49,-0.54,-2.451%,1136676566.00,United States,2010,138268,Miscellaneous,Business Services
QQQX,Nuveen NASDAQ 100 Dynamic Overwrite Fund Shares of Beneficial Interest,$25.846,0.106,0.412%,1058566222.00,United States,,112260,,
QRHC,Quest Resource Holding Corporation Common Stock,$2.20,0.00,0.00%,40438699.00,United States,,78150,Technology,Diversified Commercial Services
QRTEA,Qurate Retail Inc. Series A Common Stock ,$10.67,-0.03,-0.28%,4451753288.00,United States,,1660797,Consumer Services,Catalog/Specialty Distribution
QRTEB,Qurate Retail Inc. Series B Common Stock ,$10.5663,-0.1937,-1.80%,4408487419.00,United States,,1600,Consumer Services,Catalog/Specialty Distribution
QRTEP,Qurate Retail Inc. 8.0% Fixed Rate Cumulative Redeemable Preferred Stock,$98.3075,-0.0725,-0.074%,0.00,United States,,27120,Consumer Services,Catalog/Specialty Distribution
QRVO,Qorvo Inc. Common Stock,$163.71,-2.73,-1.64%,18671797038.00,United States,,628048,Technology,Semiconductors
QS,QuantumScape Corporation Class A Common Stock,$100.85,-14.35,-12.457%,36604701967.00,United States,2020,15393827,Miscellaneous,Industrial Machinery/Components
QS.WS,QuantumScape Corporation Warrants,NA,,,,United States,,0,,
QSR,Restaurant Brands International Inc. Common Shares,$60.71,0.15,0.248%,18402005954.00,Canada,2014,821789,Consumer Services,Restaurants
QTNT,Quotient Limited Ordinary Shares,$5.36,-0.12,-2.19%,541476414.00,Switzerland,2014,618381,Health Care,Biotechnology: In Vitro & In Vivo Diagnostic Substances
QTRX,Quanterix Corporation Common Stock,$45.55,-2.51,-5.223%,1442485781.00,United States,2017,321250,Capital Goods,Biotechnology: Laboratory Analytical Instruments
QTS,QTS Realty Trust Inc. Class A Common Stock,$60.68,-0.52,-0.85%,3909946383.00,United States,2013,220598,Consumer Services,Real Estate Investment Trusts
QTS.PRA,QTS Realty Trust Inc.,NA,,,,,,0,,
QTS.PRB,QTS Realty Trust Inc.,NA,,,,,,0,,
QTT,Qutoutiao Inc. American Depositary Shares,$1.585,-0.035,-2.16%,422919292.00,China,2018,2881460,Technology,Computer Software: Programming Data Processing
QTWO,Q2 Holdings Inc. Common Stock,$125.43,-1.50,-1.182%,6758565888.00,,2014,151032,Technology,Computer Software: Prepackaged Software
QUAD,Quad Graphics Inc Class A Common Stock,$3.80,-0.12,-3.061%,203894738.00,United States,,163076,Miscellaneous,Publishing
QUIK,QuickLogic Corporation Common Stock,$3.57,-0.34,-8.696%,39514470.00,United States,1999,96160,Technology,Semiconductors
QUMU,Qumu Corporation Common Stock,$7.68,0.14,1.857%,105314650.00,United States,,40364,Technology,Computer Software: Prepackaged Software
QUOT,Quotient Technology Inc. Common Stock,$9.625,-0.125,-1.282%,875928496.00,,2014,175346,Consumer Services,Advertising
QURE,uniQure N.V. Ordinary Shares,$36.62,-0.43,-1.161%,1629448683.00,Netherlands,2014,304175,Health Care,Major Pharmaceuticals
QVCC,QVC Inc. 6.250% Senior Secured Notes due 2068,$25.28,-0.02,-0.079%,0.00,United States,2019,48820,Consumer Services,Catalog/Specialty Distribution
QVCD,QVC Inc. 6.375% Senior Secured Notes due 2067,$25.72,-0.125,-0.484%,0.00,United States,2018,6073,Consumer Services,Catalog/Specialty Distribution
R,Ryder System Inc. Common Stock,$61.77,-1.22,-1.937%,3328731128.00,United States,,159920,Consumer Services,Rental/Leasing Companies
RA,Brookfield Real Assets Income Fund Inc. Common Stock,$17.64,-0.14,-0.787%,774225121.00,,2016,130574,,
RAACU,Revolution Acceleration Acquisition Corp Unit,$10.4701,0.1001,0.965%,0.00,United States,2020,180942,Finance,Business Services
RACA,Therapeutics Acquisition Corp. Class A Common Stock,$14.00,-0.33,-2.303%,244074600.00,United States,2020,5791,Finance,Business Services
RACE,Ferrari N.V. Common Shares,$230.71,2.10,0.919%,57237954077.00,,2015,254612,Capital Goods,Auto Manufacturing
RAD,Rite Aid Corporation Common Stock,$16.8002,-0.1998,-1.175%,927775942.00,United States,,2042215,Health Care,Medical/Nursing Services
RADA,RADA Electronic Industries Ltd. Ordinary Shares,$9.785,-0.415,-4.069%,425501361.00,Israel,,432814,Technology,Electronic Components
RADI,Radius Global Infrastructure Inc. Class A Common Stock,$13.215,0.025,0.19%,772086375.00,United States,,216501,Consumer Services,Real Estate
RAIL,FreightCar America Inc. Common Stock,$2.36,-0.27,-10.266%,36662196.00,United States,2005,447626,Capital Goods,Railroads
RAMP,LiveRamp Holdings Inc. Common Stock,$72.96,-0.30,-0.41%,4838163867.00,United States,2018,289050,Technology,EDP Services
RAND,Rand Capital Corporation Common Stock,$19.9871,1.9171,10.609%,51642109.00,United States,,60589,Finance,Finance: Consumer Services
RAPT,RAPT Therapeutics Inc. Common Stock,$19.785,-0.345,-1.714%,485825799.00,United States,2019,188659,Health Care,Major Pharmaceuticals
RARE,Ultragenyx Pharmaceutical Inc. Common Stock,$142.65,-27.24,-16.034%,9437124585.00,United States,2014,1006895,Health Care,Major Pharmaceuticals
RAVE,Rave Restaurant Group Inc. Common Stock,$0.8881,-0.0419,-4.505%,15990155.00,United States,,311044,Consumer Non-Durables,Food Distributors
RAVN,Raven Industries Inc. Common Stock,$32.64,-1.10,-3.26%,1170267542.00,United States,,134275,Capital Goods,Specialty Chemicals
RBA,Ritchie Bros. Auctioneers Incorporated Common Stock,$69.24,-1.11,-1.578%,7596481175.00,Canada,,208331,Miscellaneous,Business Services
RBAC,RedBall Acquisition Corp. Class A Ordinary Shares,$11.00,0.01,0.091%,790625000.00,United States,2020,301538,Finance,Business Services
RBAC.U,RedBall Acquisition Corp. Units each consisting of one Class A ordinary share and one-third of one redeemable warrant,NA,,,,United States,2020,0,,
RBAC.WS,RedBall Acquisition Corp. Redeemable warrants each whole warrant exercisable for one Class A ordinary share at an exercise price of $11.50 per share,NA,,,,United States,,0,,
RBB,RBB Bancorp Common Stock,$15.40,-0.17,-1.092%,303674032.00,United States,2017,28465,Finance,Major Banks
RBBN,Ribbon Communications Inc. Common Stock,$6.535,-0.015,-0.229%,950166984.00,United States,,144811,Technology,EDP Services
RBC,Regal Beloit Corporation Common Stock,$120.75,-1.49,-1.219%,4901880302.00,United States,,206348,Consumer Durables,Metal Fabrications
RBCAA,Republic Bancorp Inc. Class A Common Stock,$35.34,-0.96,-2.645%,739159848.00,United States,1998,14495,Finance,Major Banks
RBCN,Rubicon Technology Inc. Common Stock,$9.25,-0.0002,-0.002%,22401854.00,United States,2007,1418,Technology,Semiconductors
RBKB,Rhinebeck Bancorp Inc. Common Stock,$8.46,-0.07,-0.821%,94187633.00,United States,2019,12367,Finance,Banks
RBNC,Reliant Bancorp Inc. Common Stock,$18.50,-0.30,-1.596%,301507006.00,United States,,7701,Finance,Major Banks
RC,Ready Capital Corproation Common Stock,$12.72,-0.23,-1.776%,692814910.00,United States,2013,339856,Consumer Services,Real Estate Investment Trusts
RCA,Ready Capital Corporation 7.00% Convertible Senior Notes due 2023,$24.75,0.06,0.243%,0.00,United States,2017,1398,Consumer Services,Real Estate Investment Trusts
RCB,Ready Capital Corporation 6.20% Senior Notes due 2026,$24.30,0.10,0.413%,0.00,United States,2019,2801,Consumer Services,Real Estate Investment Trusts
RCEL,Avita Therapeutics Inc. Common Stock,$18.95,0.15,0.798%,409761289.00,Australia,,69938,Health Care,Medical/Dental Instruments
RCG,RENN Fund Inc Common Stock,$1.6865,0.0114,0.681%,10037974.00,United States,,26107,,
RCHG,Recharge Acquisition Corp. Class A Common Stock,$10.1166,-0.0134,-0.132%,260502450.00,United States,2020,51847,Finance,Business Services
RCHGU,Recharge Acquisition Corp. Unit,$10.63,-0.22,-2.028%,0.00,United States,2020,8588,Finance,Business Services
RCHGW,Recharge Acquisition Corp. Warrant,$1.69,-0.18,-9.626%,0.00,United States,2020,44301,Finance,Business Services
RCI,Rogers Communication Inc. Common Stock,$46.82,0.08,0.171%,23640603389.00,Canada,,78404,Consumer Services,Television Services
RCII,Rent-A-Center Inc. Common Stock,$37.79,-0.38,-0.996%,2048435293.00,United States,1995,274717,Technology,Diversified Commercial Services
RCKT,Rocket Pharmaceuticals Inc. Common Stock,$55.91,-0.41,-0.728%,3347703837.00,United States,2015,287572,Health Care,Major Pharmaceuticals
RCKY,Rocky Brands Inc. Common Stock,$28.115,-0.155,-0.548%,203620948.00,United States,1993,12955,Consumer Non-Durables,Shoe Manufacturing
RCL,D/B/A Royal Caribbean Cruises Ltd. Common Stock,$71.485,-1.405,-1.928%,16036896219.00,United States,1993,2696980,Consumer Services,Marine Transportation
RCM,R1 RCM Inc. Common Stock,$23.89,-0.04,-0.167%,2787065262.00,United States,,505820,Consumer Services,Other Consumer Services
RCMT,RCM Technologies Inc. Common Stock,$2.20,-0.23,-9.465%,25220041.00,United States,,753218,Technology,Professional Services
RCON,Recon Technology Ltd. Ordinary Shares,$1.3465,-0.0535,-3.821%,9698613.00,China,2009,246290,Energy,Oilfield Services/Equipment
RCP,Ready Capital Corporation 6.50% Senior Notes due 2021,$25.31,-0.01,-0.039%,0.00,United States,2018,2901,Consumer Services,Real Estate Investment Trusts
RCS,PIMCO Strategic Income Fund Inc.,$6.8774,-0.0426,-0.616%,302165446.00,United States,1994,185338,,
RCUS,Arcus Biosciences Inc. Common Stock,$27.50,-1.03,-3.61%,1785390860.00,,2018,236641,Health Care,Major Pharmaceuticals
RDCM,Radcom Ltd. Ordinary Shares,$10.45,0.10,0.966%,145711205.00,Israel,1997,4824,Technology,Computer peripheral equipment
RDFI,Rareview Dynamic Fixed Income ETF,$26.8202,0.00,0.00%,,,2020,10,,
RDFN,Redfin Corporation Common Stock,$72.54,-0.92,-1.252%,7424034558.00,United States,2017,1031653,Finance,Real Estate
RDHL,Redhill Biopharma Ltd. American Depositary Shares,$8.806,-0.724,-7.597%,331941333.00,Israel,,241381,Health Care,Major Pharmaceuticals
RDI,Reading International Inc Class A Common Stock,$5.12,0.09,1.789%,111355889.00,United States,,43822,Consumer Services,Movies/Entertainment
RDIB,Reading International Inc Class B Common Stock,$21.76,0.00,0.00%,473262527.00,United States,,109,Consumer Services,Movies/Entertainment
RDN,Radian Group Inc. Common Stock,$19.75,-0.37,-1.839%,3783242218.00,United States,,428475,Finance,Property-Casualty Insurers
RDNT,RadNet Inc. Common Stock,$19.06,-0.04,-0.209%,984184047.00,United States,,106816,Health Care,Medical Specialities
RDS.A,Royal Dutch Shell PLC Royal Dutch Shell American Depositary Shares (Each representing two Class A Ordinary Shares),NA,,,,,,0,,
RDS/B,Royal Dutch Shell PLC,$34.43,0.31,0.909%,,Netherlands,,2210721,,
RDUS,Radius Health Inc. Common Stock,$18.38,0.00,0.00%,855540973.00,United States,2014,257641,Health Care,Major Pharmaceuticals
RDVT,Red Violet Inc. Common Stock ,$25.845,-0.215,-0.825%,314017655.00,United States,,17741,Technology,Computer Software: Prepackaged Software
RDWR,Radware Ltd. Ordinary Shares,$27.63,-0.02,-0.072%,1275405718.00,Israel,1999,79727,Miscellaneous,Business Services
RDY,Dr. Reddy's Laboratories Ltd Common Stock,$70.05,-0.37,-0.525%,11622350093.00,India,,32526,Health Care,Major Pharmaceuticals
RE,Everest Re Group Ltd. Common Stock,$228.7397,-2.0403,-0.884%,9141736052.00,Bermuda,,72940,Finance,Property-Casualty Insurers
REAL,The RealReal Inc. Common Stock,$20.25,-0.59,-2.831%,1793692492.00,United States,2019,1002435,Consumer Services,Other Specialty Stores
REC,Emles Real Estate Credit ETF,$25.445,0.00,0.00%,,,2020,2,,
REDU,RISE Education Cayman Ltd American Depositary Shares,$5.95,0.00,0.00%,335450058.00,China,2017,11777,Consumer Services,Other Consumer Services
REED,Reeds Inc. Common Stock,$0.6258,0.0018,0.288%,52255299.00,United States,,482069,Consumer Non-Durables,Beverages (Production/Distribution)
REFR,Research Frontiers Incorporated Common Stock,$2.83,0.07,2.536%,89359474.00,United States,,251815,Miscellaneous,Multi-Sector Companies
REG,Regency Centers Corporation Common Stock,$45.40,-0.365,-0.798%,7703477993.00,United States,1993,447482,Consumer Services,Real Estate Investment Trusts
REGI,Renewable Energy Group Inc. Common Stock,$69.05,-5.05,-6.815%,2715924247.00,United States,2012,963978,Basic Industries,Major Chemicals
REGN,Regeneron Pharmaceuticals Inc. Common Stock,$484.76,1.80,0.373%,51726928537.00,United States,1991,432897,Health Care,Major Pharmaceuticals
REI,Ring Energy Inc. Common Stock,$0.638,-0.042,-6.176%,52104567.00,United States,,2771317,Energy,Oil & Gas Production
REKR,Rekor Systems Inc. Common Stock,$7.485,-0.525,-6.554%,246812314.00,United States,,529344,Capital Goods,Telecommunications Equipment
RELL,Richardson Electronics Ltd. Common Stock,$4.51,0.03,0.67%,59566520.00,United States,1983,19489,Technology,Electronic Components
RELX,RELX PLC PLC American Depositary Shares (Each representing One Ordinary Share),$24.93,0.20,0.809%,48167418460.00,United Kingdom,2015,349104,Consumer Services,Publishing
RENN,Renren Inc. American Depositary Shares each representing fifteen Class A ordinary shares,$5.20,-0.01,-0.192%,122615178.00,China,2011,42849,Consumer Durables,Automotive Aftermarket
REPH,Recro Pharma Inc. Common Stock,$2.96,-0.10,-3.268%,69988108.00,United States,2014,549212,Health Care,Major Pharmaceuticals
REPL,Replimune Group Inc. Common Stock,$40.52,-0.06,-0.148%,1862397015.00,United States,2018,396448,Health Care,Biotechnology: Biological Products (No Diagnostic Substances)
RES,RPC Inc. Common Stock,$3.13,-0.01,-0.318%,673161503.00,United States,,485777,Energy,Oilfield Services/Equipment
RESI,Front Yard Residential Corporation Common Stock,$16.19,0.02,0.124%,951116294.00,United States,,188292,Finance,Real Estate
RESN,Resonant Inc. Common Stock,$2.625,-0.075,-2.778%,142212438.00,United States,2014,3150171,Technology,Semiconductors
RETA,Reata Pharmaceuticals Inc. Class A Common Stock,$129.68,0.38,0.294%,4683490590.00,United States,2016,199768,Health Care,Major Pharmaceuticals
RETO,ReTo Eco-Solutions Inc. Common Shares,$0.615,-0.0521,-7.81%,14843025.00,China,2017,350522,Capital Goods,Industrial Machinery/Components
REV,Revlon Inc. New Common Stock,$12.43,-0.81,-6.118%,662930110.00,United States,1996,128192,Consumer Non-Durables,Package Goods/Cosmetics
REVG,REV Group Inc. Common Stock,$8.93,-0.38,-4.082%,566842493.00,United States,2017,65268,Capital Goods,Auto Manufacturing
REX,REX American Resources Corporation,$74.10,-0.37,-0.497%,444007348.00,United States,,11382,Basic Industries,Major Chemicals
REXR,Rexford Industrial Realty Inc. Common Stock,$48.41,-0.41,-0.84%,6318739503.00,United States,2013,187431,Consumer Services,Real Estate Investment Trusts
REXR.PRA,Rexford Industrial Realty Inc.,NA,,,,,,0,,
REXR.PRB,Rexford Industrial Realty Inc.,NA,,,,,,0,,
